{
    "$schema": "http://json-schema.org/draft-07/schema#",
    "type": "array",
    "items": {
      "type": "object",
      "properties": {
        "name": {
          "type": "string"
        },
        "rank": {
          "type": "integer"
        },
        "charasteristic": {
          "type": "string"
        },
        "iscareerskill": {
          "type": "boolean"
        },
        "type": {
          "type": "string"
        }
      },
      "required": ["name", "charasteristic", "type"]
    }
  }